[
  {
    "name": "ripgrep",
    "category": "CLI",
    "language": "Rust",
    "description": "Recursively searches directories for a regex pattern and prints the matches, respecting your .gitignore by default.",
    "why": "It is the search tool we reach for first. Fast enough that you stop batching greps and just ask.",
    "repo": "https://github.com/BurntSushi/ripgrep",
    "audience": "Anyone who still greps large trees by hand and wants an instant search that respects .gitignore.",
    "quickstart": "rg 'TODO' --type js"
  },
  {
    "name": "fzf",
    "category": "CLI",
    "language": "Go",
    "description": "A general-purpose command-line fuzzy finder that plugs into shells, editors, and any pipeline that emits lines.",
    "why": "One binary that quietly upgrades history search, file jumping, and git checkout. Learn it once, use it everywhere.",
    "repo": "https://github.com/junegunn/fzf",
    "audience": "Terminal users who want fuzzy history search, file-jumping, and git checkout without memorizing exact paths.",
    "quickstart": "brew install fzf && vim $(fzf)"
  },
  {
    "name": "htmx",
    "category": "Web",
    "language": "JavaScript",
    "description": "Gives you AJAX, WebSockets, and server-sent events straight from HTML attributes, no build step required.",
    "why": "A reminder that a lot of interactive UI never needed a framework. Great for small, sturdy interfaces.",
    "repo": "https://github.com/bigskysoftware/htmx",
    "audience": "Teams building small, sturdy UIs who don't want a full SPA framework's build step and bundle size.",
    "quickstart": "<script src=\"https://unpkg.com/htmx.org\"></script>"
  },
  {
    "name": "Zod",
    "category": "Web",
    "language": "TypeScript",
    "description": "TypeScript-first schema validation that infers your static types from a single source of truth.",
    "why": "Write the schema once and get parsing, validation, and types for free. It removes a whole class of drift.",
    "repo": "https://github.com/colinhacks/zod",
    "audience": "TypeScript teams tired of writing runtime validation and static types twice for the same shape.",
    "quickstart": "npm install zod"
  },
  {
    "name": "Astro",
    "category": "Web",
    "language": "TypeScript",
    "description": "A content-focused web framework that ships zero JavaScript by default and lets you bring any UI library you like.",
    "why": "It is what this very page is built on. The islands model makes fast, mostly-static sites the easy path.",
    "repo": "https://github.com/withastro/astro",
    "audience": "Teams building mostly-static, content-heavy sites who want islands of interactivity, not a full SPA runtime.",
    "quickstart": "npm create astro@latest"
  },
  {
    "name": "Playwright",
    "category": "Testing",
    "language": "TypeScript",
    "description": "Reliable end-to-end browser testing across Chromium, Firefox, and WebKit through one consistent API.",
    "why": "Auto-waiting and honest tracing mean fewer flaky tests and faster answers when something breaks.",
    "repo": "https://github.com/microsoft/playwright",
    "audience": "QA and dev teams who want one API for end-to-end tests across Chromium, Firefox, and WebKit.",
    "quickstart": "npm init playwright@latest"
  },
  {
    "name": "DuckDB",
    "category": "Data",
    "language": "C++",
    "description": "An in-process analytical SQL database — think SQLite, but built for fast queries over local files.",
    "why": "Query a pile of CSV or Parquet files with real SQL and no server to stand up. It changes how you explore data.",
    "repo": "https://github.com/duckdb/duckdb",
    "audience": "Anyone with a pile of CSV or Parquet files who wants real SQL without spinning up a database server.",
    "quickstart": "duckdb -c \"SELECT * FROM 'data.csv' LIMIT 5\""
  },
  {
    "name": "Meilisearch",
    "category": "Data",
    "language": "Rust",
    "description": "A fast, typo-tolerant search engine you can drop into an app and have returning relevant results in minutes.",
    "why": "Sensible defaults out of the box. You get search that feels good without tuning a heavyweight cluster.",
    "repo": "https://github.com/meilisearch/meilisearch",
    "audience": "Teams adding search to an app who want typo-tolerant, relevant results without tuning a heavyweight cluster.",
    "quickstart": "curl -X POST 'http://localhost:7700/indexes/movies/documents' --data-binary @movies.json"
  },
  {
    "name": "Caddy",
    "category": "Self-hosting",
    "language": "Go",
    "description": "A web server with automatic HTTPS. Sensible defaults get a real site online from a one-line config.",
    "why": "TLS certificates renew themselves and stay out of your way. The shortest honest path from box to live site.",
    "repo": "https://github.com/caddyserver/caddy",
    "audience": "Anyone self-hosting a site who wants HTTPS to just work without touching Certbot or nginx configs.",
    "quickstart": "caddy reverse-proxy --from example.com --to localhost:3000"
  },
  {
    "name": "Uptime Kuma",
    "category": "Self-hosting",
    "language": "JavaScript",
    "description": "A self-hosted monitoring tool: a clean, friendly status page and alerting for the services you run.",
    "why": "Set it up in an afternoon and finally know when something is down before your users tell you.",
    "repo": "https://github.com/louislam/uptime-kuma",
    "audience": "Self-hosters who want to know a service is down before a user tells them, without paying for a SaaS monitor.",
    "quickstart": "docker run -d --name uptime-kuma -p 3001:3001 louislam/uptime-kuma"
  },
  {
    "name": "Excalidraw",
    "category": "Design",
    "language": "TypeScript",
    "description": "A virtual whiteboard for hand-drawn-style diagrams — fast, collaborative, and usable offline.",
    "why": "The lo-fi look keeps diagrams feeling like thinking, not deliverables. Perfect for sketching a system live.",
    "repo": "https://github.com/excalidraw/excalidraw",
    "audience": "Teams who want to sketch a system or flow live on a call without their diagram looking like a deliverable.",
    "quickstart": "npm install @excalidraw/excalidraw"
  },
  {
    "name": "Biome",
    "category": "Dev tools",
    "language": "Rust",
    "description": "One fast toolchain that formats and lints JavaScript and TypeScript, replacing several tools with a single binary.",
    "why": "Near-instant runs and one config file. Less time arguing with tooling, more time writing the thing.",
    "repo": "https://github.com/biomejs/biome",
    "audience": "JS/TS teams tired of juggling ESLint, Prettier, and their conflicting configs across a monorepo.",
    "quickstart": "npx @biomejs/biome check --write ."
  }
]
